lead_id,name,email,message,source,timestamp
L201,Rajesh Kumar,bishwajit.1804@gmail.com,"Hi, we are a real estate startup looking for lead automation. Need something urgently for our sales team.",LinkedIn,2026-02-06 10:30
L202,Priya Sharma,bishwajit.1804@gmail.com,"Interested in AI solutions for our coaching business. Want to know more.",Website,2026-02-06 11:15
L203,Amit Patel,shailsong113@gmail.com,"Just browsing. What do you offer?",Cold Email,2026-02-06 12:00
L204,Sneha Reddy,bishwajit.1804@gmail.com,"We need help with following up on our leads. Our team is overwhelmed. Can you help this week?",Referral,2026-02-06 13:45
L205,Vikram Singh,bishwajit.1804@gmail.com,"Saw your profile. Tell me about pricing.",Instagram,2026-02-06 14:20
L300,Demo User,bishwajit.1804@gmail.com,Need urgent demo,Website,2026-02-10 21:30:00
L301,Demo shahil,bishwajit.1804@gmail.com,Need urgent demo,Website,2026-02-10 21:30:00
